{
  "$schema": "https://droposs.org/schemas/drop-plugin.schema.json",
  "id": "my-metadata-plugin",
  "name": "My Metadata Provider",
  "version": "1.0.0",
  "description": "Drop metadata provider plugin for importing game details and artwork",
  "author": "Heretek Games",
  "license": "MIT",
  "apiVersion": 2,
  "targets": [
    "server"
  ],
  "trust": "trusted",
  "storageVersion": 1,
  "capabilities": [
    "metadata:provider",
    "network",
    "storage"
  ],
  "server": {
    "entry": "dist/src/index.js",
    "source": "src/index.ts",
    "capabilities": [
      "metadata:provider",
      "network",
      "storage"
    ]
  },
  "checksum": "4b4d8aa64f747b9611e00609a3036b493ba030a3e5aadf4d68fcf7752fef88a9",
  "files": {
    ".gitignore": "c7ecb5dd064aa6e25e6d7afb4258dc3132295a306a5c1d343676ef541763d0bd",
    "dist/src/index.js": "4b4d8aa64f747b9611e00609a3036b493ba030a3e5aadf4d68fcf7752fef88a9",
    "dist/src/index.js.map": "904c14711dda7e966d9d534e53f277e895c87411b486d76424eee15a1963bafb",
    "dist/test/index.test.js": "640511eaf5d061c82d6cdf609bd518cd8033e05a59f7642418231ba69e9ed59a",
    "package.json": "86dbe2c6a0412914c40ee2692b730262602437b19e5c06c15e0f654b27feb427",
    "src/index.ts": "546e73733177bd21ec77bcef1c77b11453ad15dbf3204d5aef8671e75ba19d48",
    "test/index.test.ts": "efd5b6120feaee7b74fb7e774d3ff243d1bf6d9195d28181c2ab615d45908b0f",
    "tsconfig.json": "a31a559ca71e6b0d196fffa84189fbaa4e117b6def7c4f45bd13645fbbfe30b9"
  }
}
