{
  "$schema": "https://droposs.org/schemas/drop-plugin.schema.json",
  "id": "my-store-plugin",
  "name": "My Store Library Scanner",
  "version": "1.0.0",
  "description": "Drop client library scanner for importing games from external stores",
  "author": "Heretek Games",
  "license": "MIT",
  "apiVersion": 2,
  "targets": [
    "client"
  ],
  "trust": "trusted",
  "storageVersion": 1,
  "capabilities": [
    "client:library-scan",
    "client:storage",
    "system:command"
  ],
  "client": {
    "entry": "dist/src/client.js",
    "source": "src/client.ts",
    "capabilities": [
      "client:library-scan",
      "client:storage",
      "system:command"
    ]
  },
  "checksum": "d6dd6f7ea2fce5f4d36b5e1c5d67acb4437a00dfbb908593dd6ac3191168ed2b",
  "files": {
    ".gitignore": "c7ecb5dd064aa6e25e6d7afb4258dc3132295a306a5c1d343676ef541763d0bd",
    "dist/src/client.js": "d6dd6f7ea2fce5f4d36b5e1c5d67acb4437a00dfbb908593dd6ac3191168ed2b",
    "dist/src/client.js.map": "d9c5c3e51398e7987190d3d2ee0f78d0151060fd662e44a94bcbff7ee78b4cff",
    "dist/test/client.test.js": "3f0b0d88df89542ad652022d50a1fa245fadc1743c9373ef37f82b1c8c15eefe",
    "package.json": "9bd246d0eeba2becc4d50e63869683cb66d2aba81a780dfabd61699da91a9dfb",
    "src/client.ts": "982c9dd2afd1afd77d9d9071c7cc97ede6143648ea8a4e71a5e80e664cb449d9",
    "test/client.test.ts": "b0cd225d32c199605e35532d1cab89fc5513cfffeb91f10c76e0cb4435ed9611",
    "tsconfig.json": "a31a559ca71e6b0d196fffa84189fbaa4e117b6def7c4f45bd13645fbbfe30b9"
  }
}
